Key	Item Type	Publication Year	Author	Title	Publication Title	ISBN	ISSN	DOI	Url	Abstract Note	Date	Date Added	Date Modified	Access Date	Pages	Num Pages	Issue	Volume	Number Of Volumes	Journal Abbreviation	Short Title	Series	Series Number	Series Text	Series Title	Publisher	Place	Language	Rights	Type	Archive	Archive Location	Library Catalog	Call Number	Extra	Notes	File Attachments	Link Attachments	Manual Tags	Automatic Tags	Editor	Series Editor	Translator	Contributor	Attorney Agent	Book Author	Cast Member	Commenter	Composer	Cosponsor	Counsel	Interviewer	Producer	Recipient	Reviewed Author	Scriptwriter	Words By	Guest	Number	Edition	Running Time	Scale	Medium	Artwork Size	Filing Date	Application Number	Assignee	Issuing Authority	Country	Meeting Name	Conference Name	Court	References	Reporter	Legal Status	Priority Numbers	Programming Language	Version	System	Code	Code Number	Section	Session	Committee	History	Legislative BodyNSVPSAKH	book	2014	"Baker, R"	Big Data in Education							2014	9/13/16 16:06	9/13/16 16:06														"New York, NY"									"<p>1.1 Introduction</p> <p>Explore big data in education</p> <p>Called educational data mining or learning analytics</p> <p>Joint goal of exlploring the big data now availabe on learners and learning</p> <p>To promote new scientific discoveries and to advance learning sciences</p> <p>To promote better assessmetns of learners along multiple dimensions</p> <p>to promote better realtime support for learners</p> <p>A few words for data miners</p> <p>may find some classic algorithms aren't well represented like neural networks - they haven't been all that heavily used in EDM and one reason is that overfitting is a plague in the highly context based and not that big data set we use</p> <p>It is big enough but not in the level of google big</p> <p>Types of EDM/LA method</p> <p>Prediction</p> <p>Develop a model which can infer a single aspect of the data (predicted variables) from some combination of other aspects of the data (predictor variables)</p> <p>Structure discovery</p> <p>Find structure and patterns in the data that emerge naturally</p> <p>Relationship mining</p> <p>Discover relationships between variables in a dataset with many variables</p> <p>Discovery with models</p> <p>Preexisting model/ applied to data and used as a component in another analysis</p> <p>Why not popular until now?</p> <p>not enough data hard to scale</p> <p>now.. mooc!</p> <p>PSLC Datashop - Actions: entering an equation, manipulating a vector, typing a phrase, requesting help</p> <p>-responses: error feedback, strategic hints</p> <p>-Annotations: correctness, time, skill/ concept</p> <p>&nbsp;</p> <p>&nbsp;</p> <p>&nbsp;</p> <p>&nbsp;</p> <p>&nbsp;</p>; <p>1.3 Classifiers, Part 1</p> <p>Classification</p> <p>there is something you want to predict (""the label"")</p> <p>the thing you want to predict is categorical</p> <p>-answer is one set of categories not a number</p> <p>-like 0,1</p> <p>-help requst/ worked example requests/ attempt to solve</p> <p>-will dropout/ won't drop out</p> <p>-will enroll in mooc ABCDEFE</p> <p>Classification: Associated with each label are a set of ""features"" which may be you can use to predict the label</p> <p>the basic idea of a classifier is to determine which features, in which combination can predict the label</p> <p>Domain specificity</p> <p>Specific algorithms work better for specific domains and problems</p> <p>step regression: not stepwise regression, used for binary classification</p> <p>fits linear regression fuction- with an arbitrary cut off/ selects parapmeters, assigns a weight to each parameter, computes a numerical value</p> <p>not prefered by statisticians but it is okay in EDM</p> <p>Logistic regression</p> <p>Given a specific set of values of predictor variables</p> <p>Fits logistic fuction to data to find out the frequency/ odds of a specific value of the dependent variable</p> <p>good for cases where changes in value of predictor variables have predictable effects on probability of predicted variable class</p> <p>Logistic and step regression are good when interactions are not particularly common</p> <p>can be given interaction effects through automated feature distillation</p> <p>Instead, use decision tree! can be adjusted to split based on more or less evidence, to prune based on more or less predictive power</p>; <p>1.4 Classifiers, Part 2</p> <p>Classifiers</p> <p>Decision rules- set of if -then rules which you check in order (if, else if )</p> <p>Many algorithms</p> <p>Differences are in terms of how rules are generated and selected/ most popular subcatergory repeatedly&nbsp; creates decision trees and distills best rules</p> <p>Generating rules from decision tree</p> <p>1. Create decision tree</p> <p>2. If there is at least one path that is worth keeping go to 3 else go to 6</p> <p>3. Take the best single path from root to leaf and make that path a rule</p> <p>4. Remove all datapoints classified by that rule from data step</p> <p>5. Go to step 1</p> <p>6. Take all remaining datapoints</p> <p>7. find the most common value for those datapoints</p> <p>8. make an ""otherwise"" rule using that</p> <p>Relatively conservative - leads to simpler model than most decision trees</p> <p>Very interpretive model</p> <p>K*</p> <p>Predicts a data point from neighboring data points - weights points more strongly if they are near by</p> <p>good when data is very divergent, might be the only tools to use in some cases (detecting emotions from the log file)</p> <p>but you need whole data set to perform this method</p> <p>bagged stumps - lots of trees with only the first feature/relatively conservative close variant is random forest</p> <p>~~~so far classifiers are conservative; find simple models, don't over fit/ these algorithm more suitable for educational data mining, which means educational data has a lot of noise~~~</p> <p>SVM: support vector machines</p> <p>Conducts dimensionality reduction on data space and then fits hyper plane which splits classes</p> <p>creates very sophisticated models</p> <p>great for text mining</p> <p>great for sensor data</p> <p>not optimal for the most other educational data</p> <p>Genetic algoriithms</p> <p>uses mutation, combination, and natural selection to search space of possible models/ can produce inconsistent answers</p> <p>Neural networks</p> <p>composes extremely complex realationships through combining perceptrons</p> <p>svm genetic algorithm and neural networks are great for some but not for al</p> <p>&nbsp;</p>; <p>6.1 Learning curves</p> <p>visualization</p> <p>Displaying information in a meaningful fashion</p> <p>induce the viewer to think about what it means</p> <p>avoid distorting what the data have to say</p> <p>Encourage the eye to compare different pieces of data</p> <p>Reveal the data at several levels</p> <p>Visualization</p> <p>A big area</p> <p>Assumptoins</p> <p>The student is practicing the same skill several time in approximately the same fashion/ similar methods and considerations apply to situations where the student is recalling the same knowledge several times</p> <p>LISP learning curve</p> <p>Learning curves- power law of learning; performance (both speed and accuracy) improves with a power function</p> <p>Called power law- speed and accuracy both follow a power curve; radical improvement at first which slows over time towards an asymptote/ passing the asymptote usually involves developing entirely new strategy</p> <p>Fosbury flop-jump</p> <p>Making inference from learning curves</p> <p>via visual inspection of the curve form</p> <p>corbett&amp;anderson- two skills go at the same time</p> <p>uses</p> <p>to study and refine item-skill mappings in educational software</p> <p>&nbsp;</p> <p>&nbsp;</p>; <p>6.3 Scatter plots</p> <p>visualization</p> <p>scatter plots</p> <p>Heat Maps</p> <p>Parameter Space Maps</p> <p>Scatterplot - don't scale large data</p> <p>Heat map - by density, intensity</p> <p>Parameter space maps - special case of heat maps</p> <p>used to look at the goodness of various parameters, particularly for BKT</p> <p>Average graph- literally average graph</p>; <p>6.4 State Space Diagrams</p> <p>Visualizations of all the states that the learning system can have during a problem</p> <p>State= complete characterization of situations</p> <p>Also referred to as student learning pathways or interaction networks</p> <p>game</p> <p>stage1 stage2 stage3 (Refraction)</p> <p>keep changing different states and find the success state</p> <p>Uses</p> <p>study specific student trajectories</p> <p>see which paths end of being productive</p> <p>see which paths are rare (despite being productive)</p> <p>make recommendation hints to students based on their path</p>; <p>7.1 Clustering</p> <p>Clustering - a type of structure discovery algorithm</p> <p>want to find what structure there is among the data points and don't know anything about a priori&nbsp; about the structure</p> <p>group together!</p> <p>k means clustering algorithms - simple</p> <p>centeroids (randomly selected)</p> <p>vonoi diagram - distribute equally</p> <p>refit centerioids</p> <p>convergence do it until fit centeroids</p> <p>&nbsp;</p>; <p>7.2 Validation and selection</p> <p>how we choose value for K?</p> <p>Distortion (Mean squared deviation)</p> <p>Take each point P</p> <p>find the centeroid of P's cluster C</p> <p>Find the distance D from C to P</p> <p>Square D to get D'</p> <p>Sum all D' to get distortion</p> <p>Distance from A to B in two dimensions</p> <p>Works between randomized restarts/ does not work for choosing cluster size</p> <p>Distance to nearest cluster center should almost always be smaller with more clusters</p> <p>It only isn't when you have bad luck in your randomization</p> <p>Cross validation cannot solve this problem - Different problem than prediction modeling; you are determining whether any center is close to a given point</p> <p>Solution - Penalize models with more clusters, according to how much extra fit would be expected from the additional clusters</p> <p>Using an information criterion</p> <p>Assess how much fit would be spuriously expected from a random N centroids ( without allowing&nbsp; the centroids to move)</p> <p>Assess how much fit you actually had</p> <p>Find the differnce</p> <p>So how many clusters?</p> <p>Try several values of K</p> <p>Find best fitting set of clusters for each value of K</p> <p>choose best point</p> <p>&nbsp;</p> <p>&nbsp;</p>"																								1																										SE5DIAI6	videoRecording	2016	Georgia Tech	Cross Validation					https://www.youtube.com/watch?v=sFO2ff-gTh0		9/9/16	9/13/16 16:06	9/13/16 16:06	9/9/16 19:37												Youtube										<p>Predicting values in the testing set</p> <p>if too much fitting in the train set it would not be generalizable since we kind of assume test set is the representative of our world</p> <p>IID independently identically distributed - Fundamental assumption for a lot of organism</p> <p>take some sample from the training data and act like if it is test data and run in order to predict</p> <p>training data divided into folds pick the lowest error one</p>		https://www.youtube.com/watch?v=sFO2ff-gTh0																																																8CJ6XRPB	webpage	2016		Passing the Privacy Test as Student Data Laws Take Effect (EdSurge News)	EdSurge				https://www.edsurge.com/news/2016-01-12-passing-the-privacy-test-as-student-data-laws-take-effect	"On January 1, 2016, “ 	SOPIPA”—the recently passed California student data privacy law that defines how edtech companies can use student data became effective. About 25 other states have passed similar laws that are already in effect, or will become effective.  At the same time, more than 200 sc"	1/12/16	9/20/16 15:24	9/20/16 15:24	9/20/16 15:24																						"<ul> <li>Gov trying to protect students info from company</li> <li>Access, must delete, do not require students to share data unless it is for educational purpose</li> <li> <p>As a student, the SOPIPA law trying to protect California Students' online privacy seems to be appropriate. If the SOPIPA law is effective, how would the company promote their product to a society where research proven results are valued?</p> </li> </ul>"	/Users/JoonyoungPark/Library/Application Support/Zotero/Profiles/dasdr1oy.default/zotero/storage/9IW3G4JV/2016-01-12-passing-the-privacy-test-as-student-data-laws-take-effect.html																																																	G53DSCAQ	webpage			Cluster					https://www.cs.uic.edu/~wilkinson/Applets/cluster.html			10/21/16 4:56	10/21/16 4:56	10/21/16 4:56																						"<p>K-means clustering</p> <p>n data points to k number of clusters by gathering near mean data points</p> <p>define it's goal geometrically k(K-1)/2 cutting planes</p> <p>identify cluster centroids and divide first pick the center randomly, need to update by adding more coordinates of the new point</p> <p>Every time re assigned, so it needs to be updated every trial</p> <p>even if it is chosen randomly, need to pick a point for more centered one</p> <p>We need to know K to determine K</p> <p>one color for normal data only!</p> <p>downfall of k-means clustering: find the center point even if the data is silly and wrong</p>"	/Users/JoonyoungPark/Library/Application Support/Zotero/Profiles/dasdr1oy.default/zotero/storage/ZD9IKMGK/cluster.html																																																	CGAS5FTV	webpage			data-wrangling-cheatsheet - data-wrangling-cheatsheet.pdf					https://www.rstudio.com/wp-content/uploads/2015/02/data-wrangling-cheatsheet.pdf			12/22/16 1:40	12/22/16 1:40	12/22/16 1:40																						"<p>This Cheatsheet really saved our semester.</p> <p>Several note to myself</p> <p>1. The data set cheat sheet is using is about flower so it is not the actual code you can use/ will upload preuploaded data on R.</p> <p>2.Gather...Spread...</p> <p>Need to upload Dplyr/ Tidyr first in the library&nbsp;so you gather the data to spread it as how you want your data to look like. If there are list of students and teachers data and want to look them by their grade, you can use spread function/ Gather is different way; gathering columms into row for one site data analysis (that histogram data assignment7)</p>"	/Users/JoonyoungPark/Library/Application Support/Zotero/Profiles/dasdr1oy.default/zotero/storage/CHS3U2UU/data-wrangling-cheatsheet.html																																																	