Key	Item Type	Publication Year	Author	Title	Publication Title	ISBN	ISSN	DOI	Url	Abstract Note	Date	Date Added	Date Modified	Access Date	Pages	Num Pages	Issue	Volume	Number Of Volumes	Journal Abbreviation	Short Title	Series	Series Number	Series Text	Series Title	Publisher	Place	Language	Rights	Type	Archive	Archive Location	Library Catalog	Call Number	Extra	Notes	File Attachments	Link Attachments	Manual Tags	Automatic Tags	Editor	Series Editor	Translator	Contributor	Attorney Agent	Book Author	Cast Member	Commenter	Composer	Cosponsor	Counsel	Interviewer	Producer	Recipient	Reviewed Author	Scriptwriter	Words By	Guest	Number	Edition	Running Time	Scale	Medium	Artwork Size	Filing Date	Application Number	Assignee	Issuing Authority	Country	Meeting Name	Conference Name	Court	References	Reporter	Legal Status	Priority Numbers	Programming Language	Version	System	Code	Code Number	Section	Session	Committee	History	Legislative BodyVUQED3Z6	conferencePaper	2013	"san Pedro, Maria Ofelia; Baker, Ryan; Bowers, Alex; Heffernan, Neil"	Predicting college enrollment from student interaction with an intelligent tutoring system in middle school	Educational Data Mining 2013						2013	9/13/16 16:06	9/13/16 16:06																							"<p>Having a higher aiming goal starting from the middle school help students to achieve higher (need to care for their own grades in order to go to the college)</p> <p>The researchers used ASSISTment system 04~05, 06~07</p> <p>(seems like ASSISTment used the theory of Vygotsky, to scaffold!)</p> <p>Student knowledge estimated by Bayesian Knowledge Tracing</p> <p>the program could predict students' college enrollment 68.6% of the time (boredom, confusion, and slip/careness are he significant determinent in college enrollment</p> <p>Possibility of interaction log?</p>"																																																		M369Z5EF	journalArticle	2012	"Greller, Wolfgang; Drachsler, Hendrik"	Translating Learning into Numbers: A Generic Framework for Learning Analytics	Journal of Educational Technology & Society		1176-3647		http://www.jstor.org/stable/jeductechsoci.15.3.42	"ABSTRACT With the increase in available educational data, it is expected that Learning Analytics will become a powerful means to inform and support learners, teachers and their institutions in better understanding and predicting personal learning needs and performance. However, the processes and requirements behind the beneficial application of Learning and Knowledge Analytics as well as the consequences for learning and teaching are still far from being understood. In this paper, we explore the key dimensions of Learning Analytics (LA), the critical problem zones, and some potential dangers to the beneficial exploitation of educational data. We propose and discuss a generic design framework that can act as a useful guide for setting up Learning Analytics services in support of educational practice and learner guidance, in quality assurance, curriculum development, and in improving teacher effectiveness and efficiency. Furthermore, the presented article intends to inform about soft barriers and limitations of Learning Analytics. We identify the required skills and competences that make meaningful use of Learning Analytics data possible to overcome gaps in interpretation literacy among educational stakeholders. We also discuss privacy and ethical issues and suggest ways in which these issues can be addressed through policy guidelines and best practice examples."	2012	9/13/16 16:06	9/13/16 16:06	9/3/16 18:55	42-57		3	15		Journal of Educational Technology & Society	Translating Learning into Numbers												JSTOR			<p>It is a how to for Learning Analytics</p> <p>6 dimensions to do Learning Analytics correctly</p> <p>Stake holders</p> <ul> <li>Institution</li> <li>Teachers</li> <li>Learners</li> <li>Other</li> </ul> <p>Objective</p> <ul> <li>Reflection</li> <li>Prediction</li> </ul> <p>Data</p> <ul> <li>Open</li> <li>Protected</li> </ul> <p>Instruments</p> <ul> <li>Technology</li> <li>Algorithm</li> <li>Theories</li> <li>Other</li> </ul> <p>External Limitations</p> <ul> <li>Conventions</li> <li>Norm</li> </ul> <p>Internal limitations</p> <ul> <li>Competence</li> <li>Acceptance</li> </ul> <p>TEL: Technology Enhanced Learning</p> <p>We should be aware that not all students put their full effort to TEL learning program which might distort the data analysis. Or do they turn out to mean something?</p> <p>&nbsp;</p> <p>&nbsp;</p>																																																		UPNATQ2U	bookSection	2006	"Kay, Judy; Maisonneuve, Nicolas; Yacef, Kalina; Reimann, Peter"	The Big Five and Visualisations of Team Work Activity	Intelligent Tutoring Systems	978-3-540-35159-7 978-3-540-35160-3			http://link.springer.com/chapter/10.1007/11774303_20	"We have created a set of novel visualisations of group activity: they mirror activity of individuals and their interactions, based upon readily available authentic data. We evaluated these visualisations in the context of a semester long software development project course. We give a theoretical analysis of the design of our visualizations using the framework from the “Big 5” theory of team work as well as a qualitative study of the visualisations and the students’ reflective reports. We conclude that these visualisations provide a powerful and valuable mirroring role with potential, when well used, to help groups learn to improve their effectiveness."	6/26/06	9/13/16 16:06	9/13/16 16:06	9/3/16 19:10	197-206											Springer Berlin Heidelberg		en	©2006 Springer-Verlag Berlin Heidelberg				link.springer.com			"<p>Computer supported collaborative learning (CSCL)/ team work do not visualized in the online learning setting</p> <p>Big five components of team work</p> <ul> <li>Team leadership</li> </ul> <p>leader assigns how many ticket to use and people interact with ticket activity</p> <p>Facilitate teem problem solving</p> <p>provide performance expectations and acceptable interaction patterns</p> <p>Synchronize and combine individual team member contributions see and evaluate information that affects team functioning</p> <ul> <li>Mutual performance monitoring</li> </ul> <p>Measured with interaction networks</p> <p>low level of interaciton, low level of monitor</p> <p>Identifying mistakes and lapses in other team members' actions</p> <ul> <li>Back up behavior</li> </ul> <p>Shift workload in the high pressure settings</p> <p>Recognition of a workload distribution problem in the team</p> <p>shifting work to under utilized members</p> <ul> <li>Adaptability</li> </ul> <p>It does not mean if it is not there the team is not successful</p> <p>Identify cues of change, assign meaning to it, develop a new plan to deal with it.</p> <ul> <li>Team orientation</li> </ul> <p>Degree of involvment, completion of milestone</p> <p>Increase task involvment, information sharing, strategising and goal settings</p> <p>Coordinating mechanisms</p> <ul> <li>Shared mental models</li> <li>Mutual trust</li> <li>Closed loop communications</li> </ul> <p>#feedback</p> <p>Visualization tools</p> <ul> <li>Activity radar</li> <li>Interaction Network</li> <li>Wattle tree</li> </ul>"		https://link.springer.com/chapter/10.1007/11774303_20		Artificial Intelligence (incl. Robotics); Computers and Education; Information Systems Applications (incl. Internet); Multimedia Information Systems; User Interfaces and Human Computer Interaction	"Ikeda, Mitsuru; Ashley, Kevin D.; Chan, Tak-Wai"																																													X839V4H2	journalArticle	2015	"Konstan, Joseph A.; Walker, J. D.; Brooks, D. Christopher; Brown, Keith; Ekstrand, Michael D."	Teaching Recommender Systems at Large Scale: Evaluation and Lessons Learned from a Hybrid MOOC	ACM Trans. Comput.-Hum. Interact.		1073-0516	10.1145/2728171	http://doi.acm.org/10.1145/2728171		2015-04	9/13/16 16:06	9/13/16 16:06	9/3/16 20:38	10:1–10:23		2	22			Teaching Recommender Systems at Large Scale												ACM Digital Library			"<ul> <li>Measurement, performance, Massively open online course, learning assessment</li> <li>Research goal summary</li> <li>Do students learn with Mooc? Do students interact with Mooc? role of recommending system in learning&nbsp; and learner experience? Will the students remember what they have learned from mooc five months later?</li> <li>Results:</li> <li>Strong will predict if the student will end the course or not/ other won't matter that much. Students learned through mooc and benefitted from mooc.. We also might conclude based on the teacher-student physical class might be that much helpful if the mooc quality is good enough. Programming students gain more knowldege (you know more, you learn more). Effort to learn only predict the actual gain of knowledge. Normalized knowledge gain is hard to predict! Need to know students' starting point and end point!</li> <li>Motivation, easy to access, need to hide some of the obvious purpose for the experiment</li> </ul>"				learning assessment; Massively Online Open Course (MOOC)																																														GKQK5NA4	bookSection	2013	"Desmarais, Michel C.; Naceur, Rhouma"	A Matrix Factorization Method for Mapping Items to Skills and for Enhancing Expert-Based Q-Matrices	Artificial Intelligence in Education	978-3-642-39111-8 978-3-642-39112-5			http://link.springer.com/chapter/10.1007/978-3-642-39112-5_45	"Uncovering the right skills behind question items is a difficult task. It requires a thorough understanding of the subject matter and of the cognitive factors that determine student performance. The skills definition, and the mapping of item to skills, require the involvement of experts. We investigate means to assist experts for this task by using a data driven, matrix factorization approach. The two mappings of items to skills, the expert on one side and the matrix factorization on the other, are compared in terms of discrepancies, and in terms of their performance when used in a linear model of skills assessment and item outcome prediction. Visual analysis shows a relatively similar pattern between the expert and the factorized mappings, although differences arise. The prediction comparison shows the factorization approach performs slightly better than the original expert Q-matrix, giving supporting evidence to the belief that the factorization mapping is valid. Implications for the use of the factorization to design better item to skills mapping are discussed."	7/9/13	9/13/16 16:06	9/13/16 16:06	9/3/16 20:44	441-450											Springer Berlin Heidelberg		en	©2013 Springer-Verlag Berlin Heidelberg				link.springer.com			"<p>Mapping items to the skill is really hard (as we already know)</p> <p>Using ALS (Alternate least-square Factorization), compare between expert defined Q matrix and a factor Q matirx</p> <p>2 or 3 changes in initial matrix lead to toward change in total ALS system</p> <p>(The article was hard to understand (T.T))</p>"		https://link.springer.com/chapter/10.1007/978-3-642-39112-5_45		alternating least squares matrix factorization; Artificial Intelligence (incl. Robotics); Cognitive modeling; Computers and Education; Educational Technology; Information Systems Applications (incl. Internet); latent skills; Pedagogic Psychology; skills assessment; Student models; User Interfaces and Human Computer Interaction	"Lane, H. Chad; Yacef, Kalina; Mostow, Jack; Pavlik, Philip"																																													7ICJGX2R	book	2015	"Matsuda, Noboru; Furukawa, Tadanobu; Bier, Norman; Faloutsos, Christos"	Machine Beats Experts: Automatic Discovery of Skill Models for Data-Driven Online Course Refinement					http://eric.ed.gov/?id=ED560513	"How can we automatically determine which skills must be mastered for the successful completion of an online course? Large-scale online courses (e.g., MOOCs) often contain a broad range of contents frequently intended to be a semester's worth of materials; this breadth often makes it difficult to articulate an accurate set of skills and knowledge (i.e., a skill model, or the QMatrix). We have developed an innovative method to discover skill models from the data of online courses. Our method assumes that online courses have a pre-defined skill map for which skills are associated with formative assessment items embedded throughout the online course. Our method carefully exploits correlations between various parts of student performance, as well as in the text of assessment items, to build a superior statistical model that even outperforms human experts. To evaluate our method, we compare our method with existing methods (LFA) and human engineered skill models on three Open Learning Initiative (OLI) courses at Carnegie Mellon University. The results show that (1) our method outperforms human-engineered skill models, (2) skill models discovered by our method are interpretable, and (3) our method is remarkably faster than existing methods. These results suggest that our method provides a significant contribution to the evidence-based, iterative refinement of online courses with a promising scalability. [For complete proceedings, see ED560503.]"	2015-06	9/13/16 16:06	9/13/16 16:06	9/3/16 20:48							Machine Beats Experts					International Educational Data Mining Society		en					ERIC			"<p>Online course programming: Who is better? Computer or human?</p> <p>To test: LFA (Learning factor analysis) vs human engineered model vs eEpiphany</p> <p>eEpiphany was the best even when using bag of words (F matrix for collected items)</p> <p>eEpiphany seems to be very effective tool to revise and give students information which course to take, but is this is only the tool that makes helpful for advising course content?</p>"		http://eric.ed.gov/?id=ED560513		Automation; Comparative Analysis; Correlation; data; Formative Evaluation; models; Online Courses; Skills																																														83JIGF4U	conferencePaper	2008	"Cortez, Paulo; Silva, Alice Maria Gonçalves"	Using data mining to predict secondary school student performance	Proceedings of 5th Annual Future Business Technology Conference	978-90-77381-39-7			http://repositorium.sdum.uminho.pt/handle/1822/8024	"Although the educational level of the Portuguese population has improved in the last decades, the statistics keep Portugal at Europe’s tail end due to its high student failure rates. In particular, lack of success in the core classes of Mathematics and the Portuguese language is extremely serious. On the other hand, the fields of Business Intelligence (BI)/Data Mining (DM), which aim at extracting high-level knowledge from raw data, offer interesting automated tools that can aid the education domain. The present work intends to approach student achievement in secondary education using BI/DM techniques. Recent real-world data (e.g. student grades, demographic, social and school related features) was collected by using school reports and questionnaires. The two core classes (i.e. Mathematics and Portuguese) were modeled under binary/five-level classification and regression tasks. Also, four DM models (i.e. Decision Trees, Random Forest, Neural Networks and Support Vector Machines) and three input selections (e.g. with and without previous grades) were tested. The results show that a good predictive accuracy can be achieved, provided that the first and/or second school period grades are available. Although student achievement is highly influenced by past evaluations, an explanatory analysis has shown that there are also other relevant features (e.g. number of absences, parent’s job and education, alcohol consumption). As a direct outcome of this research, more efficient student prediction tools can be be developed, improving the quality of education and enhancing school resource management."	2008-04	9/13/16 16:06	9/13/16 16:06	9/4/16 1:23												EUROSIS	"Porto, Spain"	eng	openAccess				repositorium.sdum.uminho.pt			"<p>Portuguese have been developed for their education, but still at the tail of the Europe's achievement.</p> <p>Situation for students achieving level for math and portuguese is serious analyze students' data with Business Intelligence and data mining results</p> <p>Goal: identify students achievement and find key variables, what makes students pass or fail</p> <p>Used classification and regression (Binary classifcation, 5 level classification, and regression) and RMiner package in R (Decision trees, random forests, Neural Networks, and support vector machines + With without past grades</p> <p>Predicted well (failures, G1 grade, G2 grade were the highest predictors)</p>"		http://repositorium.sdum.uminho.pt/handle/1822/8024																																	5th Annual Future Business Technology Conference															